{
  "schema_version": 1,
  "work_item_id": "PCR02-OTA-ARTIFACT-IDENTITY-V1.1.21",
  "execution_id": "ota-download-test-pr1-pr2",
  "executor_identity": "engineer-plus-github-actions",
  "started_at": "2026-09-14T00:00:00Z",
  "finished_at": "2026-09-14T16:00:00Z",
  "repo_root": "jiying2007/ota_download_test",
  "base_commit": "eeb926bd1fff75d2a5d5abb9f0ede9c8f582cc6d",
  "result_commit_or_patch": "7aba8279f96ed47bde3f84a4b2be6b796466d181",
  "dirty_baseline": null,
  "changed_files": [".github/workflows/verify-ota.yml", "README.md", "ota-manifest.v1.json", "tests/test_verify_ota_manifest.py", "verify_ota_manifest.py"],
  "outcomes": ["Added PCR02 v1.1.21 machine-readable OTA identity manifest.", "Added fail-closed OTA artifact verifier and negative tests.", "Added Hosted CI verification of the real OTA package.", "Retained machine-readable verification receipt as a workflow artifact."],
  "decisions": ["Kept package bytes unchanged.", "Separated artifact identity PASS from device/release readiness."],
  "validation": {"host": "pass", "cross_build": "not_run", "sil": "not_run", "hil": "not_run", "release": "not_run"},
  "commands": ["python -m unittest discover -s tests -v", "python verify_ota_manifest.py --manifest ota-manifest.v1.json"],
  "artifact_refs": ["github-actions artifact:10355541476", "ota-verification-receipt.json"],
  "artifact_hashes": ["ota_pkg_v1.1.21.tar.gz sha256:7687d8058f85271e75ff3726957385afa1618aa2078dc0a6b3215d470af4a4bb", "verification-artifact-archive sha256:5da3d9945051bc2741effa0064ae3ee4ef25cc31cf1c0372f393916596c3ab7a"],
  "knowledge_refs": [],
  "evidence_refs": ["implementation PR head:943a7a6b4dceec97e8d7b2f62a137d5c136bb105", "merged implementation:5f31e39284d2ebbfbcea7a771c4360d7bc29bd05", "retained-evidence main:7aba8279f96ed47bde3f84a4b2be6b796466d181", "PR CI:34861966225", "fresh-main CI:34862064742", "retained receipt CI:34862735035"],
  "unverified_items": ["Device OTA download/install/boot/rollback not evaluated in this Feature Pilot."],
  "blockers": [],
  "risks": ["Artifact identity evidence must not be extrapolated to device or release PASS."],
  "next_actions": ["Consume this artifact identity receipt in the separate Review/Release Pilot."],
  "approval_required": []
}
