{
  "schema_version": 1,
  "work_item_id": "EMB-001",
  "execution_id": "exec-001",
  "executor_identity": "engineer-plus-engineering-agent",
  "started_at": "2026-09-11T06:00:00+08:00",
  "finished_at": "2026-09-11T06:30:00+08:00",
  "repo_root": "firmware/main",
  "base_commit": "0123456789abcdef0123456789abcdef01234567",
  "result_commit_or_patch": "patch:spi-timeout-fix",
  "dirty_baseline": "clean",
  "changed_files": ["drivers/spi/example.c"],
  "outcomes": ["Added bounded timeout recovery"],
  "decisions": ["Kept change local to SPI transfer path"],
  "validation": {"host": "not_run", "cross_build": "pass", "sil": "not_run", "hil": "blocked", "release": "not_run"},
  "commands": ["make cross-build"],
  "artifact_refs": ["artifact://build/example.bin"],
  "artifact_hashes": ["sha256:example"],
  "knowledge_refs": [],
  "evidence_refs": ["evidence://cross-build/001"],
  "unverified_items": ["HIL stress test pending device reservation"],
  "blockers": ["HIL device unavailable"],
  "risks": ["Runtime behavior not yet verified on target"],
  "next_actions": ["Run HIL stress test"],
  "approval_required": ["Device write approval"]
}
