{
  "schema_version": 1,
  "work_item_id": "EXAMPLE-EMB-001",
  "execution_id": "EXAMPLE-EXEC-001",
  "executor_identity": "engineer-plus-engineering-agent",
  "started_at": "2026-09-14T10:00:00+08:00",
  "finished_at": "2026-09-14T10:30:00+08:00",
  "repo_root": "firmware/main",
  "base_commit": "1111111111111111111111111111111111111111",
  "result_commit_or_patch": "patch:example-ecc-status-mapping-fix",
  "dirty_baseline": "clean",
  "changed_files": ["drivers/mtd/example_nand.c"],
  "outcomes": ["Corrected the scoped ECC status mapping"],
  "decisions": ["Did not change UBIFS behavior or partition layout"],
  "validation": {"host": "not_run", "cross_build": "pass", "sil": "not_run", "hil": "pass", "release": "not_run"},
  "commands": ["make example_cross_build", "run-example-storage-regression"],
  "artifact_refs": ["artifact://example/firmware.bin"],
  "artifact_hashes": ["sha256:example-firmware-artifact"],
  "knowledge_refs": [],
  "evidence_refs": ["evidence://example/cross-build", "evidence://example/device-regression"],
  "unverified_items": [],
  "blockers": [],
  "risks": [],
  "next_actions": ["Independent verification and review"],
  "approval_required": []
}
